Sno,review,vader_compound,vader_neg,vader_new,vader_pos,Vader_Sentiment,Company
27,"Buying our car from BuySide Auto was the easiest, fastest, and most pleasant experience we've had EVER!!!  This is the first time we've purchased a car online, and we didn't know what to expect. In the past, we would literally spend half the day at the dealership to test drive, negotiate, and sign paperwork. With BuySide Auto, the entire car-buying process has been streamlined. We spent some time researching what SUV we wanted to get. Once we narrowed it down to 2 brands (BMW & Acura), we reached out to Kim Hoang at BuySide. She helped us every step of the way. She answered all of our questions and went over the deal sheets carefully. It's obvious that she is knowledgeable! Unlike the sales people at car dealerships, Kim is not pushy, very patient, most of all, honest. When we finally decided on what car to buy, we filled out the credit application online. And in a matter of 2 days, our 2019 Acura RDX was delivered to our door by Chris. 2 days!!! It was so easy. It's important to note that Chris didn't just deliver the car; he also took the time to show us how the car works. If you want a hassle-free experience and impeccable service, look no further. BuySide Auto will help you find the exact car you want at the best price. You won't be disappointed!",0.9837,0.009,0.841,0.15,Positive,Buy Side Auto
28,"Buying or leasing a car through BuySide Auto was such a stark contrast to the abysmal buying experience at a a dealership. But not only was it light years better, in contrast, it was fantastic in its own right! It was fast, easy, provided the information I needed at my fingertips, and where I had questions, my rep was friendly and helpful!",0.9725,0,0.707,0.293,Positive,Buy Side Auto
29,"This review is about my experience while trying to sell my car.Pros:- The website is pretty straightforward with the ability to upload pictures of your car.- Chris is responsive.Cons:- The offer that I got was way lesser than CarMax and Autonation! Yes, lesser than the dealership too! So do shop around at other places, especially CarMax.- The website says you'll get an offer within 3 hours. But that's incorrect. I got an offer after ~1.5 days. Chris said the website needs to be updated.",0.6351,0,0.927,0.073,Positive,Buy Side Auto
30,"Steve Harvey: Name one thing Americans loathe.Me: CAR DEALERS!Steve Harvey: Survey says....BING #1Have you ever done your internet research and decide to purchase a new car? Then come to the realization that you have to put on some MMA gear to go spar with the liars at the car dealerships? Well, that's what almost happened to me. Until I found Roadster - a car broker that allows you to purchase your new car online. That's right folks. As Vince Vaughn would say ""On the line."" Welcome to 2017.Roadster's website is fantastic. User interface is simple and gets right to the point. Pick out your make, model, and options, and it gives you an estimate of your total cost. Cash, finance, lease. Doesn't matter. A broker is a must if you have a particular set of options and want no more, no less. Like me. I ""needed"" a new Honda Accord. But I only wanted the Sport model, and only in white pearl, AND only with a manual transmission. I did my own homework - there were only 2 in the entire state of CA. One in Norcal, the other in SoCal. Did Roadster pull it off? You bet they did.Roadster partners with thousands of dealers, but they can't have relationships with each one. So, if the car you want is not in their network, they go to bat for you and do some sort of underground car dealer trading that we're not privy to. Which is what happened in my case. Try that solo.My experience - Monday night, I go to Roadster's website, pick out my car with only the options I want. Tuesday morning, I start getting emails from Kim explaining the process. I put down $100 of the $295 broker fee. I complete info for credit app. Tuesday afternoon - they start the search. Find one of two. They start pleading and begging (sort of) on my behalf with their partners/dealers. Wednesday - they continue to broker my transaction, and come to terms. Some kind of barter takes place. Thursday - the exact car I selected online gets driven from San Jose up to my neighborhood dealer in the Tri-Valley and gets prepped. I get an email from Kim saying to expect deliver in the afternoon. Thursday 3pm, Mike drives a white Accord sport stick shift into my driveway. Goes over the car. We sit down. He presents lease docs. And 10 minutes later. D-U-N done.  I last leased a truck about 2 years ago, and I'm not ishing you...spent about 8 hours there over the span of 2 days just negotiating. With two little girls, mind you. I swear, it's like Congress trying to pass a budget.Wow. $295 extra is 100% worth it. The only time I went to a dealer was to sit in a preowned one. That's another story for another day.Because of my particular situation, there were a few hiccups. But Kim made everything right. And that's all that matters. Good work Roadster team! You'll be hearing from me again next year.",0.9518,0.016,0.929,0.055,Positive,Buy Side Auto
31,"Have you ever walked out of a dealership after buying or leasing a car and felt you got hosed? It's because you probably did, to be expected when going up against the teams of professional negotiators/shysters found at most auto dealerships.But there's a better way, and it's called Roadster. We worked with Mark Hugret and he was fantastic. Mark negotiated great lease pricing for us and promptly presented us with the results, and we never had to leave home!",0.9009,0,0.857,0.143,Positive,Buy Side Auto
32,"I found out about Roadster by chance during the last stretch of my exhausting car research routine. I planned on going to a dealership the following week. End result, within 1 week (last week) I took delivery of my new 2017 Audi A4 Premium Plus Quattro! And as of a few hours ago, I said good riddance to my current lease with a buyout for the exact payoff amount from Roadster. In all seriousness, Roadster honestly takes the crap factor out of the whole car buying experience. I'm happy that I found them when I did because I was able to appreciate what was presented to me. This was a lease, so the math can be tricky so as long as you do your homework, you can tell if your getting a good deal or not. I was able to confirm the exact breakdown of the lease before committing to anything. Knowing the mf and residual for an exact model is critical. So do your homework. After researching the legitimacy of the company, I started the process online. Less than 24 hrs later, I got a call and it was history from there.  I can't stress enough about how freaking convenient it was using a broker / car buying service to do the dirty work for you. My wife almost passed out when she heard she didn't have to go into a dealership. I saved roughly 10% off MSRP and with Audi that's pretty good. Coupled with not having to spar with the salesman and his ""manager"", it's priceless. I do want to say thank you to both Mark (who took care of the purchase) and Jay (who handled the trade in). They were there throughout the entire process and made me feel as if I was their only client. You guys rock. Everybody, use them!",0.9658,0.051,0.831,0.119,Positive,Buy Side Auto
33,"Mark Hugret helped my wife lease a new Jeep Grand Cherokee, he also assisted us with getting rid of our previously leased Jeep Grand Cherokee. He found my wife the exact model with the exact features she requested and it was delivered to our home! I haven't had the pleasure of meeting Mark Hugret in person, but if I did, I'd probably kiss him!So, a quick recap... We got rid of a leased car, got a new leased car, we never left our house, and the only person we dealt with in person was the young fellow that delivered and/or took our cars. If you live in California and you don't contact Mark Hugret and Roadster to buy, lease, or sell your next car you are stupid and you should reconsider your life choices!",0.2446,0.048,0.89,0.062,Neutral,Buy Side Auto
34,"I discovered Roadster (now BuySideAuto) through RealCarTips.com after Googling car buying advice. RealCarTips is a trusted step-by-step resource to negotiate new car prices with dealerships, so for them to recommend BuySideAuto is already a big plus. Once you narrow down the vehicle of your choice, go to BuySideAuto's website to get an immediate express price. Their web interface is very user friendly and I often find myself checking real car prices just out of curiosity, as no sign up is required and even when you sign up, they don't spam or push/annoy you. I was specifically interested in a 2018 white Honda Accord Hybrid Base, and wouldn't settle for any other colors, trims, or options. This hybrid model was just released in April 2018, and dealerships were barely getting any stock, but somehow BuySideAuto was able to secure one for me in mid-May 2018 at near dealership invoice price (which RealCarTips always tries to push you to reach), not the MSRP/sticker price! And to put that into perspective, my out-the-door (after taxes/fees) cost was almost the sticker price!When I tried searching all the local Bay Area Honda dealerships, no one would barely consider any haggling on the price because the vehicle was so new. I checked to see if there would be any new Honda holiday incentives because Memorial Day was coming up, but nope, no manufacturer rebates/discounts for hybrid models. I compared all the websites like TrueCar, Edmunds, Kelley Blue Book, Carjojo, Cars, and Consumer Reports for real-time quotes, but none offered any real deals, other than like only $500 off. I bought my last car through TrueCar in 2012 but their pricing has gone downhill and isn't as competitive as when that company first started. I finally reached out to BuySideAuto (Kim) and she mentioned that the longer I wait and the closer it gets to the holidays, that specific model (color and trim) would likely sell out and I may have to wait for dealerships to re-stock. I jumped on it, filled out some online forms on Thursday afternoon, and after a few calls and emails, Kim somehow secured the deal and I was in my brand new car the next day on Friday at noon! She was very detailed in her responses, kept me up-to-date throughout the entire buying process with the dealership, and was very transparent about the pricing and how they were able to secure a good deal. Chris delivered the car to my work (but you can get it delivered to your home or elsewhere) and just like at the dealership, he went through the car-specific features and walkthroughs, along with signing and explaining the finance paperwork. The advantage of the delivery service is not only for convenience, but so you don't have to sit through any last-minute dealer negotiations (like options, packages, warranty, etc.). Cheers to Kim and Chris for pulling this through in less than 24 hours, and for sure securing a better deal (even after factoring the broker fee) than I would have ever been able to. My experience couldn't have gone any better and is highly recommended.",0.9954,0.016,0.86,0.124,Positive,Buy Side Auto
35,"I've used BuySide twice in the past 4 years, and recommended them to my in-laws last year, and all three experiences were great. I will never go to another dealership again. Chris walked me through all the options and ins-and-outs of leasing vs. buying, and helped me narrow down my choices of what vehicle would be right for me, and then completely delivered. Chris explained everything, answered every question, giving me insight and knowledge so I could make an informed decision. His guidance, and the simple fact that all the paperwork was done ahead of time, and all I had to do was sign, made the car buying/leasing experience simple and painless. Definitely worth the money.",0.9201,0,0.875,0.125,Positive,Buy Side Auto
36,"Like many others, I have gotten only the best service from the Roadster team!Thanks to Kim Hoang for locating my desired vehicle within an hour of me submitting a request on the Roadster website. After that, she kept constant communication with me and made sure I knew exactly what I was getting into, explained all the details on the deal sheet, and made sure I was happy with my purchase. I wanted the car to have a few accessories installed before it's delivered to me, and Roadster did just that! No muss, no fuss.Now I'm a very happy owner of a new Honda Accord Touring V-6. The entire process was less than 5 days. Thank you Kim, Chris (delivered and explained new features of the car, walked me through the paperwork, awesome guy!), and the Roadster team!",0.9747,0.03,0.78,0.19,Positive,Buy Side Auto
37,"The people at Roadster are awesome. What you ask? People? you thought this was an online buying service, didn't you? Well, they are and they aren't. if you have visited a couple of car dealerships and you are sick of talking to salespeople you can enter the car you want online and have it delivered. If you have some questions, and aren't sure if you can get the trim line you want without the extra this and that, they can help with that too. We had figured out what we wanted, but had a couple of short phone conversations to make sure we got what we wanted. A few hours later a deal sheet appeared with a good price. we ok'd and the car was at our door the next afternoon. Chris, who delivered the car stepped us through all the necessary controls and we did the paperwork in less than 15 minutes. Couldn't be happier with Roadster, even if tacos came with the car.",-0.2812,0.068,0.871,0.061,Neutral,Buy Side Auto
38,"Happy to give a very positive feedback to the Roadster team! Lots of thanks to Mark Hugret who provided an amazing customer experience at every step with helping me lease my new Mustang. Hassle free coordination and smooth delivery. I am very picky and the idea of picking up my car online was a new concept, as I like to see ""the goods"" before I purchase. I was in awe when I saw the car! Love it! Thank you once again to Mark who went out of his way to answer every question I had. Thank you Roadster.Sincerely,Marina",0.9853,0,0.712,0.288,Positive,Buy Side Auto
39,"We will never go back to the dealership again! So much easier and straightforward, and feel that you got the best deal possible. Kim helped us out through the whole process and explained things, And she seems to really love her job because she even answered questions from home and in the car. Chris deliver the car and picked up our trade-in at the same time, got a decent price on that too. Good price, no up selling or pressure, friendly people, and get a lot done online at our leisure. All great things for us. New 4runner looks great!Thanks all!",0.9659,0.037,0.77,0.193,Positive,Buy Side Auto
40,Our experience  with Dale at Albany Subaru was 12 on a scale  of 1 to 10..He went above expectations of delivering our car as promised in perfect condition...He was informative thorough and polite showing exemplary customer service.We recommend Albany Subaru to anyone who wants a positive experience. Thankyou!Michael amd Mary Knight..,0.9117,0,0.777,0.223,Positive,Subaru
41,"Go see Don Myers for a no frills, direct, honest and clean transaction with your car. A good friend of mine bought a car from him the week before and said it was pretty seamless. After an annoying experience with the last Subaru dealership, I decided to go directly to Don.Don is a good man. Not your typical overly talkative, bs salesperson. I just didn't want that experience. Who does? This is my first purchase and I had loads of questions. Don was patient and made sure to give me the time I needed. I had done a lot of research beforehand, so I knew I wanted the Crosstrek Premium and they had it in stock. Go see Don. He is your guy.Thanks Don!",0.94,0.047,0.791,0.161,Positive,Subaru
42,"I'm pretty sure most everyone dreads the process of buying a car, no exception here, but let me tell you:1. Buy a Subaru. This is a win and you'll be so happy.2. Buy a Subaru only at Albany Subaru. They will take good care of you and make this a very positive experience.",0.9682,0.052,0.607,0.341,Positive,Subaru
43,"Need a whip? Call Dante. I was down and out been dragging my heels for years on a new car. My wife and I were on San Pablo looking and Dante invited us in. He showed us the car we needed and arranged for the financing. So, no matter who you are, if you got loot then it's all good. Dante and his manager were more friendly, accommodating, and professional than any of the dozens of spots we went.",0.6,0.035,0.87,0.095,Positive,Subaru
44,"Thanks to Don Myers for his many years of patience  while we thought about getting a Subaru. He's always been there patiently for when we were ready to proceed! We finally did it, and he made the whole process relatively painless and expedient. Highly recommended place to buy a car - good discount and no sales pressure.",0.8169,0.068,0.731,0.2,Positive,Subaru
45,"I'm a geek at consumer research who reads lots of reviews. But I don't write many unless I feel sincerely compelled. I just became a happy owner of a 2020 Outback Limited XT. As this is my 2nd Subaru, satisfaction was an easy sell. But what exceeded my expectation was the ""easy-peasy"" sales experience I had with Don Huey, and Darcie (in finance).  My car was advanced-ordered, with an estimated 10-week ETA. So, I had to restrained myself from bugging Don with a zillion (delivery status) calls. He was always sweet about it and gave me a teaser status anyway.  Candidly speaking, all Subaru dealers are not created equal, and Albany Subaru scores pretty high as a go-to if you want a pleasant, no-pressure experience. I drove away feeling pretty cool about it. And best of all, my dogs think the cargo area is heaven.",0.9933,0.048,0.655,0.297,Positive,Subaru
46,"We absolutely love our new 2019 Ascent.We checked out 4 other dealerships, before settling with Sheik and Albany Subaru. Only 2 of the 4 dealerships actually did an appraisal on my trade in on the spot, one was Albany, and they also were the only ones that followed up with us and showed that we were valuable as customers. They were great and we couldn't be more happy with our new Subaru.",0.8583,0.04,0.813,0.146,Positive,Subaru
47,"Buying a Subaru was a no brainer but which dealer to buy from was a long drawn out process. I dealt with three dealerships and had some unpleasant experience. Ultimately, I bought my new Crosstrek from Chris Mangasarian. It was a pleasure working with Chris throughout the entire process. He is very patient, lays out all the information and exerts no pressure, definitely none of the normal salesmanship that you may expect. I would recommend working with him and this dealership!",0.4199,0.125,0.74,0.134,Neutral,Subaru
48,"Been meaning to leave this review for awhile as a warning to the community...In June 2019, my spouse and I went to Albany Subaru (the used lot in El Cerrito) for an Outback, my dream car. Our salesperson was a young guy who'd told us this was his first month on the job, still learning the ropes--hadn't made a sale yet. During the test drive, he couldn't tell us much about the specific car's history or the model, but was very sweet, personable, and accommodating. The car drove great. We got back to the lot, spent some time sitting in the car, did some additional research, and felt pretty much set to make the purchase. We just wanted to take a look at a mechanic's report.Around this point, another dealer who was ""mentoring"" the younger one took the reins. As we started to fill out some preliminary paperwork for my credit check, we made repeated (polite but firm) requests to see the mechanic's report. He seemed pretty hesitant to show us anything and kept hemming and hawing about how all their cars are inspected and have to pass certain standards to even be sold. We insisted anyway. Finally, they produced an ""in-house"" report from the parts and services department that looked all clear... Thank goodness we were wise enough to follow some family advice and get the car inspected by an independent mechanic as well, before signing a contract.At this point the younger dealer was feeling very proud to be making his first sale, and offered to pay for the independent inspection. We felt very endeared to him and were excited to be part of this moment in his career. Our trust in the business was bolstered by his offer as well.This is where things got ugly. We took the car up San Pablo to a very nice Midas mechanic. We waited a few minutes. The moment he put the car up on the lift, he beckoned us over to come see. The car had a huge, deep scrape down the center of its undercarriage. He explained that the damage to various parts was worth at least $3000 in parts, if not more, and that the car would probably break down very soon on the road without the necessary repairs. It seemed like it had been driven over a tell parking block or something similar. So that was that. We called the younger dealer. He was ashen-faced when we showed him the Midas mechanic's report. It was clear at that point-- after he'd paid for the $150 inspection and demonstrated real surprise and disappointment at its result-- that he was not clued into the true condition of the car.We got back to the lot and tried to call out the other dealer. He basically was not able to give us a straight answer about why his mechanic's report was inaccurate. He said it had been done that morning (the car had just arrived to them the day before), so there was little chance that it had been driven over something since entering the hands of the dealership. We couldn't get him to explain and aspect of the discrepancy between the two mechanics' reports.Because, like I said, the Outback is my dream car, I offered to buy the car anyway at a discount equal to the repairs, and they flat-out refused. They said, ""We don't do that kind of thing."" I checked back on the car listing over the following weeks and the price didn't budge at all. Clearly they were planning to try to scam someone else in a similar way.So, the used sales department gets 1 star for being dishonest (or incompetent), as well as being unkind to their young employee.",0.9943,0.058,0.809,0.133,Positive,Subaru
49,"""Truly the best!""Don truly is the best- He has been working with me over the phone and through emails for over a week. He has diligently responded to all of my questions and concerns. Don has been nothing short of extremely professional and responsive. I had a great buying experience at Albany Subaru with Don's help and Albany staff.",0.9631,0,0.716,0.284,Positive,Subaru
50,"Don Myers is by far the best salesman I've ever dealt with. He made the experience of purchasing a new car so easy and painless. He was clear with us about everything as we walked through the process and we both felt in solid, capable hands. Also he is quite charming and funny and down to earth, no smarmy salesman vibes whatsoever. We did the Costco pricing as well and he handled everything we wanted with friendliness and ease. If you are looking into a Subaru, this dealership is highly recommended over the Oakland one.",0.9833,0.019,0.688,0.294,Positive,Subaru
51,"I recently bought a used Subaru from Abraham and new salesman Nick and was pleasantly surprised by the experience.  Used car salespeople have a bad reputation.  I took my car for its first oil service and noticed leaking on my garage floor.  My mechanic inspected and said it was the dreaded Subaru head gasket leaking.  So, I called and spoke to Nick who said he'd need to talk to his manager Jay and would call back - I a few hours later called Abraham who said that those Foresters had weeping head gaskets and if it wasn't over heating my mechanic did not know Subaru cars and he would talk to Jay and get back to me.  Day ended with no call so I called before leaving work and Abraham said jay was in meetings but they will call about my concerns in the morning.  Will update tomorrow.  I liked these guys and hope they are willing to help but head gaskets are expensive and I've already had to replace front struts and front brakes.  Optimistically waitingJay called and was very helpful referred me to a shop to check out my car Monday.  His call was a very kind and caring act!  Abraham also called and was reassuring and told me he stands by his sales and he would be there as we go through this process!  I am impressed.",0.9889,0.032,0.805,0.163,Positive,Subaru
52,"Great experience buying a new Ascent!After a thorough search, Albany Subaru was the only shop that had the model we wanted in stock. We were able to obtain a quote via email and follow up over the phone. Albany Subaru also had the best price!Dale, our salesman, was great... the car was detailed and ready for me to test drive when I got there. I did not feel pressured and had ample time to look at the vehicle for myself without anyone watching over my shoulder. The entire process, including the financing portion, went smoothly.  There were no hidden fees/add-ons and everything was clearly laid out for me. A few days after the purchase, Dale checked-in and was readily available for any questions and concerns.It has been about two weeks with the Ascent and we love it!",0.9586,0.015,0.847,0.138,Positive,Subaru
