Sno,review,vader_compound,vader_neg,vader_new,vader_pos,Vader_Sentiment,Company
0,"We are currently doing our research into the possibility of getting a Tesla and weighing all the factors into such a major purchase. Last Friday I came in and chatted with Rotex who is one of the customer representatives. He answered all my questions with a zero pressure feel, which I appreciated. Our family is considering either the model 3 or the Y, however we were concerned over whether it would fit in our garage in the City. He mentioned that he can answer that question easily by doing a garage fit. It's only specific to SF customers since our old houses have sometimes challenging garages. He said he can come over today, Monday to do the fit. He called 45 mins before the appointment to insure there would be no issues on our meeting time which was very considerate.He arrived and easily fit in the garage and went over some interesting features on the car. I was also concerned over cargo room and prepared a large roller, 22 inch carry on and a stroller and asked him if I can try to fit it on the trunk. He was very accommodating and we both figured out how it would fit. It swallowed it up with room to spare.At least we know that we can go with either model, and if we go smaller, we won't have to worry about not enough room.He said if I had any questions and if we want to set up a road test, just call him.I have to say this was a refreshingly nice experience and it only makes it easier to go with this super innovative company.Great job Tesla.",0.9889,0.015,0.827,0.158,Positive,Tesla
1,"This dealership has owed me $21,000 for the past 4 months. It's outrageous. I bought a car partially financed back in June and then decided I wanted a different color. So I took advantage of their 7-day return policy and returned the first car. Then I decided to lease instead. They told me that it might take a month or two to receive the refund for the first car, which sounded a little bit long to me. But I waited. After 2 months I started calling the dealership and Tesla finance to inquire about the $21K. Sometimes they would tell me that the check is in the mail. Sometimes they made it sound like they had lost the car! Nobody ever got back to me, despite promising to. I eventually wrote a threatening letter to Tesla corporate and that seemed to prompt some action. They had me come in a month ago to sign some DMV paperwork they had forgotten to have me sign before. Yet, they couldn't tell me when I would receive my refund. Nobody is returning my calls at this point. This experience has been so painful that I'm thinking about returning the Tesla I have. I l love the car but the company itself is a mess. I'm going to hire a lawyer this week and sue them.",-0.9145,0.104,0.848,0.047,Negative,Tesla
2,"During my first time I went into the San Francisco Tesla for service, the technician was able to identify the issues. 1. My car's trunk opened in the middle of the freeway.2. My car was making weird noises when making full turns.However, there were no loaners and my service adviser Sheri offers me $100/day Uber credits for commute or reschedule for an appointment. My daily commute is about 40miles to work one way and it would cost more than $100/day to take Uber, so I did not want to take that option. Sheri promised me if I reschedule for 2 weeks later, she will guarantee a loaner for me. She even puts that on the notes for my next appointment to reserve a vehicle with carpool lane sticker for me. Two weeks later, I went in for my rescheduled appointment and Sheri told me there is no loaner, so she will give me Uber credits. I told her the only reason for the reschedule was because you did not have a loaner for me 2 weeks ago and you guaranteed me you will get me one this time. Are you saying there were no one returning a loaner for the past 2 weeks? Sheri replied with ""Nothing can be guarantee. We can only give you Uber credits."" I was unhappy but unwilling to take another day off to go in for service because they do not open on weekends. I even took Uber screenshots and showed her my one way trip goes over $100 each way. I ended up taking other transportation to work that week after spending all the Uber credits.On a Friday, Sheri told me the car is fixed and they could deliver the car back to my house for free. I said I will take that service please. I asked her about what was done to the car and she informed me about the service. The trunk parts were replaced for free and they found debris inside my rotors that were causing the noises. And because they did not have to replace any parts for the turning issue, it means Tesla is not at fault and the charge would be $195. I disagreed with the charge because my car is only a year old and warranty should cover for the problem. She then ignores me and would not reply to my calls or texts. There were no communication at all and the car was not delivered to my house that Friday. On the next Monday, I called in and text her again in the morning. She ignores me again... I am going to assume she has a hangover or something so she could not go to work on Monday. I went into SF myself to get my car(Uber credits expired on Saturday), so I am paying to drive there even though they are suppose to deliver me the car on Friday. I talked to the first guy I saw and his name is David. He helped me cover the $195 using my warranty because they did find issues with the car creating the noise and my car is only a year old. Hence, I am giving this review a 2 stars because David is very nice and professional.",0.9431,0.044,0.888,0.068,Positive,Tesla
3,"Aside from my strong feelings as a usability researcher that the Tesla 3's UI is terrible if not dangerous for people driving a car (the primary job of this piece of metal), this dealership was meh in convincing me I should go for it against my better judgment. Ha! Context: I actually am looking for a new car. The 3 is within the price range we'd consider and I can charge for free at work and get valet parking. Given regular parking at work is like a daily re-enactment of lord of the flies, i could be swayed to fork over extra to regain 15 minutes of sanity in the morning. Pros: Sexy cars, obviously. I can charge said sexy car at work and save a bundle. Cute kid area to entertain your small dependents while waiting for a test drive. The 3 and its luxurious counterparts are up for playing with in the showroom. Cons: In the middle of the bleeping city. If you're looking for a test drive, a block away in either direction is a busy street. If you wanted to test the vehicle for zippiness or speed I challenge you to find a driver adjacent to you who will give you the space. I'd recommend going to another dealership in any quieter area where you can actually exercise any speedy attributes this car has. Keep in mind as other reviews have mentioned, you're responsible for damages (or at least that's what the signoff states, and the guy who handed me the keycard asked if I had insurance). The people working there act like you should know all the expected esoteric shit these cars want you to do. Why do you think I'm here seeing this thing in person? No, really, tell me how to turn off this stupid ho ho ho Santa mode crap because the instructions on screen are actually not working (what other controls are inaccurate here?). Disorganized way of setting up test drives. We must have been there for 45 minutes having talked to a guy early on who said ok we are good to get the next drive available. Next, we find out we had to sign in etc and need to now wait for everyone else in the queue for longer. Given how disorganized the place was I can't imagine what getting service for these vehicles is like, given the fact you can't really go elsewhere. Sounds appealing.... They call us a few days later asking if we're ready to buy one. Like literally in the first minute of the convo. Nope nope nope!! Rather stay in my 2009 Honda hooptie with the paint peeling off. Fix your UI and your attitude and I'd consider it.",0.9826,0.055,0.821,0.124,Positive,Tesla
4,"Quick delivery by Lee.  Detailed explanation and car was perfect.  No hard copy of any paperwork (eco friendly), all pdf on your tesla account to view or print out if you like.No talking to a finance guy on extended warranties or clear bras or upsells.Easy pick up of car ever.  Everything was done online.  Come in, sign a few spots, and drive off.",0.5719,0.054,0.852,0.094,Positive,Tesla
5,"Love the technology. Hate the service. The person I worked with are rude, condescending.They never called me to tell me my car was ready. When I called into inquire about the status, I was put on hold for 14 minutes. No check in during that time I was on the phone, just made me hold the entire time.When I arrive to pick up the car, I gave them my name and the color and model number of my car. The representative checking for my car kept on typing on the computer, it seemed like he could not find my car. Important note, my car was towed in from Tesla roadside service. It seems like he could not find my car on the system, so I asked ""is was my car here?"" And he replied ""don't jump to conclusions, I will find your car. ""I replied, ""I'm not jumping to conclusions, I'm just inquiring if you have my car.""He then showed me to their waiting room and seemed very upset. At this point I still did not know if they had my car.I noticed he was on the phone and talking to multiple people outside the glass door waiting room. Eventually, I saw him drive my Model 3 into the service center. He motioned me over to my car. Still unhappy with the communication during this service pick up, I asked what his name was. He said ""John"". I asked, ""John, what is your last name?"". He replied ""Smith"".",-0.2853,0.058,0.883,0.06,Neutral,Tesla
6,"Wow, unbelievable. There is person working there who goes by C.K. who is incredibly rude. He refused to give his name (had to ask his co-workers for the name) He was just yelling at me, telling me that he doesn't like me, refusing to help and asking me to call him Rambo if I want to?! This was my second interaction with him, and it's horrible. He actually told me that he will call security on me because I asked his co-workers about his name. What a shame! I truly like Tesla but leaving people like him to work makes me hate that place.Don't go there unless you really have to. I had a wonderful experience with the people in the Marin office.",-0.5359,0.142,0.733,0.124,Negative,Tesla
7,"I had an excellent car shopping experience at this dealership, which operates far above and beyond the average semi-predatory car dealership. I experienced low to no pressure, as the salesperson - Renee - let the car sell itself. There is no negotiating on price, which takes a little away from being able to enjoy a sense of fighting for a good deal, but it was also a relief to forgo all of the preparatory research, intense negotiations, and the inevitable and exhausting rounds of, ""Let me see what my manager thinks."" You don't have to commit an entire day of your life to buy a car from this dealership; the process is straightforward, streamlined and fast. Everyone I spoke with was pleasant, helpful and friendly, a welcome change from the stressed out faces and clipped responses I've experienced at other dealerships when dealing with anyone other than my salesperson. Sales is a difficult and honorable profession, and it's always a pleasure to see it done right, as it is at this dealership.",0.9726,0.102,0.705,0.194,Positive,Tesla
8,how much does a tesla cost? and the official lamborghini service center tie in at this location? wow that's expensive stuff. then do us all a favor sweep the sidewalks. pick up all the trash. it is a store's responsibility - keep it clean.,0.8611,0,0.795,0.205,Positive,Tesla
9,"We had an extremely negative experience at Tesla. After our test drive and leaving the show room, I was called and told we were liable for $200 for ""tire damage."" After speaking with a manager I was then emailed a charge for $250. No explanation or photo of tire damage, reason, etc..I wish I had looked at similar reviews about the liability agreements and similar charges before test driving. The entire experience left us with a very negative feeling about Tesla and the Van Ness location in particular. As the brand becomes more mainstream, I hope their customer service shifts to be in line with other luxury brands.",-0.8191,0.146,0.771,0.083,Negative,Tesla
10,"The service center here is TERRIBLE. I had a tire that needed to be patched and the target time of 10:30am passed with zero updates. I tried texting back, calling, emailing, logging onto the website to chat per the instructions on their voicemail (there was no chat function available) and it was a black hole with no one picking up the phone. I finally called Sales and was simply transferred to the number that NO ONE was picking up over the course of 3 hours. The second time I called Sales and explained the issue they walked over to talk to someone in Service and I finally got a call back saying my car would be ready at 2pm at the latest. I showed up at 2:30pm and my car was. not. ready. I raised the issue when I was there and they simply said the text service must be down. Yeah, I know because I told my service rep that I had texted him back and he said he didn't get it and said the same thing but what are you going to do to fix/escalate it?? Nothing was done about it. Service was a sh*t show, DON'T COME HERE. On top of this, they changed the service that was agreed without telling me, and only informed me when I paid. Four days later and Corporate still hasn't responded to my original messages. Extremely disappointed in Tesla. Made me realize that you are paying $$$ money without the equivalent service you would expect from any other established dealership and questioning whether I should be a Tesla owner. If you have a similar issue, I was informed that you can file with the Bureau of Automotive Repair bar.ca.gov/Consumer/Auto…. Maybe this will encourage Tesla to get their act together.",0.6234,0.047,0.89,0.064,Positive,Tesla
11,"Finally my model x is ready after three month wait and I was under the assumption that since I ordered the car in the Corte Madera showroom, I would be picking it up there, but I was told I have to either go to the Van Ness showroom or Fremont. Then I asked if I can have a ride from Marin to the showroom and was told I need to get there with my own transportation. I asked my friend to drive me and called on my way to see where we should park since my friend wanted to go in with me and check out the car, this time I was told to find my own parking on the street or just park at the amc theater. Pick up experience is ok, a bit rushed but seems like they just want to get you out of the door as soon as possible. Not very well organized... and they always answer my questions with it will take 24 hours to work or just call customer service and they will help you with that. Lastly before we left, I asked if they have any key chain to give me and was told they are out of it and have no idea when they will be getting it. Didn't even offer to send me one when they have it back in stock. I am not sure this is the way they doing business all across the country but if I am buying a 100k plus car they should at least try to provide some basic amenities like a pick up service and at least a free key chain or two. When I bought my s class two years ago, they delivered my car via tow truck to my house and throw in many free items like rubber floor mats, key chains and license plate frames. Not impressed at all, hope they will improve.",0.9876,0.033,0.836,0.131,Positive,Tesla
12,"I've always had great service here and the staff are all very friendly.  My tire pressure was low in one tire and I drove in without an appt- they took me right in without any question. They have a nice waiting area with lots of seating, a few tables, water and coffee. They also have a little kids area for them to play. When you get service, ask for a loaner car. You may or may not get a replacement Tesla, but at least you'll get a car :) They also have security here making sure no one can just walk in to use the restrooms if they are not a customer. Great service.",0.7938,0.084,0.767,0.149,Positive,Tesla
13,"Scheduled a service appointment a month in advanced for my Model S' broken door handle and general maintenance. A week leading up to the scheduled appointment, the back triangular window got broken into and I added that into the notes on the Tesla portal in case that the shop takes more than a week to fix (I actually had it fixed at a local shop in less than a day). I later received a text from Tesla saying my appointment had been canceled because they don't service cars with broken windows. No one even bothered to double-check with me.TLDR; Be very careful about what notes you enter for your appointment. They are trigger-happy and will cancel your appointment without verifying anything with you.Not a 1-star review because the Jeremy, the Tesla rep. whom I was voicing this concern to did an excellent job trying to resolve the issue. Also, their car pick-up experience was pretty nice, with the bow and everything.",0.101,0.093,0.812,0.095,Neutral,Tesla
14,"My experience with Tesla has kind of stunk. This review isn't regarding the actual cars (which still seem cool to me) but my experience with the dealership and Tesla as an overall organization. There's just been endless chaos and frustration since I decided to get my car. Deliveries getting cancelled on multiple occasions, miscommunications (I'm going to assume the best and say that people aren't outright lying to me). The most egregious thing is that it's been incredibly difficult to get a hold of anyone. I'll talk to someone on Monday and by Wednesday, that person's number has changed or their voicemail is full and there's essentially no way to get a hold of them. I've spent hours (that's not an exaggeration) on hold with customer service, only to be promised a call back from a manager that doesn't happen. Anyways, you get the point. Dealing with Tesla stinks right now. Maybe it's just a logistical hell they're going through and only temporary. Who knows, but unless you're desperate to get an electric car right now, I would recommend holding off or at least going through another dealer.",-0.9315,0.147,0.765,0.088,Negative,Tesla
15,"While I do enjoy my Tesla, the customer service is non-existent. I have written them three times this month and they say they will get back to you within 24-48 hours. Well the first e-mail was a month ago and the last 10 days ago and still no response. I have had trouble getting help in the past and my feeling now is perhaps I should have waited for a more established company to come out with a comparable car as it is apparent that Tesla and Elan Musk have no clue about customer service. I expected much better. I'm writing this after hearing the same complaint from other Tesla owners. Much improvement is needed.",0.7269,0.076,0.797,0.127,Positive,Tesla
16,"I went in for a model 3 test drive, I was told after arrival that you need to be over 21 years of age to test drive a vehicle. I did not know this & this information is not on the Tesla website. I ended up choosing to go on a ride along in a Model 3 performance, with Varsha as the driver. Varsha was amazing! She helped me understand so much about the car & the technology inside the vehicle. Overall I guess I'll have to wait a few years to test drive a Tesla.",0.6239,0,0.951,0.049,Positive,Tesla
17,This location is my favorite!  I've been here twice now for service and the customer service is fantastic. Everyone is super friendly and relatable. Where we use to go in SoCal they always seemed super entitled and semi rude. Quite frankly that's kind of what I was expecting here but it was totally the opposite. Thanks for always taking great care of me Tesla SF. And a special shout out to the super pretty girl in service with the tattoos for laughing at my jokes!,0.9926,0.017,0.583,0.4,Positive,Tesla
18,"They don't honor what they say. I had a flat, called roadside but since it is driveable, they advised to stop by service and get it serviced ""while you wait"". Just to make sure, I called in and spoke with someone that I will drop by and that it will be serviced while I wait. I left work and once there I was told they are too busy and can't service the vehicle! They added that I can come back between 3-5pm or buy the tire from the tire shop across the street! Wow, that is an a-class service for a $100k+ vehicle! From service experience in both San Francisco and Burlingame over the past two years, I came to conclude that I made a terrible mistake buying a Tesla. Next year, I will be buying anything else but Tesla. Time is valuable, respect is important, and service is paramount and they consistently exhibits disregard to all!!",0.6862,0.102,0.781,0.117,Positive,Tesla
19,Horrible service. Felt swindled. No customer care. They didn't know what is covered or not covered under warranty. Had to call online to get my concerns voiced. ROBERT was my service advisor and he was not helpful at all.,-0.5903,0.174,0.757,0.069,Negative,Tesla
20,"You need to do yourself a favor and use Chris at BuySide Auto for your next auto / truck purchase.  This was our first experience using a car broker, and will now be our go-to in the future.  Chris' communication was prompt, informative and direct and his fee is nominal, especially considering the time and hassle you save.  What a relief not spending hours at the dealership haggling over price. He's going to get you the best price, as he works with the dealerships directly and has established relationships with them.  He's been doing this for 15 years (I think?) and his professionalism shows this. This is starting to sound like a commercial, but I can not say enough positive things about this experience as well as Chris.  If you value your time and peace of mind, this is your auto broker.   I never post reviews, but just had to for this.",0.9163,0.024,0.852,0.124,Positive,Buy Side Auto
21,Easy - Fast - Awesome- Great - Out Standing - Are you serious. We are overly happy about this place. They really do care! Thanks again.,0.9699,0.034,0.394,0.571,Positive,Buy Side Auto
22,BuySide Auto is a great establishment and they go out of their way to help a customer. I had some questions while in the market for leasing a Mercedes and he helped all the way . Chris has great customer service and he will make sure you get the best deal in the area . He's very upfront and honest! It's hard to find people like that nowadays.They have also the most reasonable rates for their outstanding service.I would highly recommend this auto broker for your future auto shopping  needs .,0.9836,0.013,0.698,0.288,Positive,Buy Side Auto
23,"I've worked with other car brokers, but Chris and BuySide has, by far, been the best experience.  BuySide's search engine is an incredible shopping & research tool, and Chris was responsive, clear in explaining the financing process and handled my trade-in.  BuySide is a billion times better than going to a dealer, and way less stressful.  Got into the car I wanted, spot on with my budget, and in a short time (2.5 days).  Thanks, Chris!",0.9547,0.045,0.727,0.229,Positive,Buy Side Auto
24,"I was really dreading leasing a new car because I really dislike dealing with car salespeople. Car dealerships feel like a maze of smoke and mirrors, bait and switches, mixed messages. I just can't with them!!! I decided I'd look on Yelp to see which dealership gets the best reviews and just lease a car from them. Not surprisingly, all car dealerships had lousy reviews! That's when I happened upon Buyside Auto. 5 stars across the board. I was like ""what is this company?!?!"" After exploring their website, I had my new car delivered to my home within a couple days! lol! It was like a dream come true to sidestep the dealership. Buyside Auto is like having your own agent. And they are succinct, efficient and skillful. They get you the best deals, they do all the legwork, and then they deliver the car to you! I will NEVER deal directly with a dealership again. I will always use Buyside Auto.",0.9542,0.069,0.757,0.174,Positive,Buy Side Auto
25,"I got my 2019 Audi A5 Sportback from Buyside Auto. It was a very professional and transparent process from searching for cars via their website, to talking with Kim on the phone as she went to search and finally to document signing with Chris at SF. I talked to Kim on a Friday and picked up the car from Chris on Monday! I got a GREAT deal and am a very happy new car owner!",0.8862,0,0.875,0.125,Positive,Buy Side Auto
26,"Our lease was up and we were dreading having to go through the whole process of leasing a new car. Our good friend recommended BuySide to help us with the process. We first began our conversations with Chris at Buyside with a narrowed list of 2-3 SUVS, along with a price point per month we were open to paying. Chris patiently walked us through each make and model and the pros and cons of each. After the initial discussion, Chris was available and involved and answered all of our questions or concerns promptly. Finally, we narrowed it down to 1 make and model, but with different features. Again, Chris walked us through the pros and cons of each featured model. Today, we're happy to report we've had our new SUV for a month and we couldn't be happier!",0.6983,0.041,0.872,0.087,Positive,Buy Side Auto
